{
  "request_id": "66666666-6666-4666-8666-666666666666",
  "control_transport_id": "22222222-2222-4222-8222-222222222222",
  "operation": "session.control.release",
  "issued_at": "2026-07-31T02:00:20Z",
  "expires_at": "2026-07-31T02:00:22Z",
  "body": {
    "lease_id": "fixture-lease-secret-not-real-0001"
  }
}
