{
  "request_id": "11111111-1111-4111-8111-111111111111",
  "control_transport_id": "22222222-2222-4222-8222-222222222222",
  "operation": "control.transport.open",
  "issued_at": "2026-07-31T02:00:00Z",
  "expires_at": "2026-07-31T02:00:03Z",
  "body": {
    "principal_id": "fixture-principal-1",
    "client_instance_id": "33333333-3333-4333-8333-333333333333",
    "session_key": "durable-root-1",
    "profile": "default"
  }
}
