{
  "request_id": "44444444-4444-4444-8444-444444444444",
  "control_transport_id": "22222222-2222-4222-8222-222222222222",
  "operation": "session.control.acquire",
  "issued_at": "2026-07-31T02:00:01Z",
  "expires_at": "2026-07-31T02:00:04Z",
  "body": {
    "runtime_session_id": "runtime-session-7"
  }
}
